Title,Discription,Url
Hello! - Official Site,"Latest celebrity news exclusives & royal updates. Top daily entertainment, film & showbiz headlines. Fashion & beauty trends & more at HELLO! Online",http://www.hellomagazine.com/
hello network,"hello connects you with people and content around your passions. Show the world who you are, express what you love, and create meaningful connections.",http://www.hello.com/en/index.html
Hello - definition of hello by The Free Dictionary,"hel·lo (hĕ-lō′, hə-) interj. Used to greet someone, answer the telephone, or express surprise. n. pl. hel·los. A calling or greeting of ""hello.""",http://www.thefreedictionary.com/hello
Adele - Hello - YouTube,"22-10-2015 · Video embedded · ‘Hello' is taken from the new album, 25, out November 20. http://adele.com Available now from iTunes http://smarturl.it/itunes25 Available …",http://www.youtube.com/watch?v=YQHsXMglC9A
Hello - Wikipedia,"Hello is alternatively thought to come from the word hallo (1840) via hollo (also holla, holloa, halloo, halloa). The definition of hollo is to shout or an exclamation originally …",https://en.wikipedia.org/wiki/Hello
Hello | Definition of Hello by Merriam-Webster,Define hello: —used as a greeting — hello in a sentence,https://www.merriam-webster.com/dictionary/hello
ADELE LYRICS - Hello,"Hello, it's me I was wondering if after all these years you'd like to meet To go over everything They say that time's supposed to heal ya But I ain't done much healing",http://www.azlyrics.com/lyrics/adele/hello.html
Hello - Adele - Vevo,Watch Hello by Adele online at vevo.com. Discover the latest music videos by Adele on Vevo.,http://www.vevo.com/watch/adele/hello/GBH481500074
"Hello-Hello: Best Language Learning apps for iPad, iPhone, …","Learn a new language anytime, anywhere with Hello-Hello. Top-selling apps for schools, libraries, companies and more!",http://hello-hello.com/
"HELLO US - Celebrity & Royal News, Photos, Babies, …","HELLO! US brings you the latest celebrity & royal news from around the world, magazine exclusives, celeb babies, weddings, pregnancies and more",http://us.hellomagazine.com/
Hello — Caller ID & Blocking - Android Apps on Google Play,"04-08-2015 · Make your phone smarter with Hello. Built by Messenger just for Android, Hello combines info from Facebook with the contact info on your phone so it's easy to …",https://play.google.com/store/apps/details?id=com.facebook.phone
Hello - Adele - VAGALUME,Video embedded · Adele - Hello (música para ouvir e letra da música com legenda)! Hello from the other side / I must've called a thousand times / To tell you I'm sorry / …,https://www.vagalume.com.br/adele/hello.html
Introducing Hello | Facebook Newsroom,"Billions of calls are made everyday on mobile phones and people often have very little information about who’s calling them. Today we are starting to test Hello, a new app …",http://newsroom.fb.com/news/2015/04/introducing-hello/
Menu | Hello Curry,CONTACT US. Hyderabad : 040 6689 6689 Bangalore : 080 3959 1099 Visakhapatnam : 0891 666 5689,http://www.hellocurry.com/
Featured | Ello,"Welcome to the Creators Network. Ello is a community to discover, discuss, publish, share and promote the things you are passionate about.",https://ello.co/
HELLO! | Facebook,"HELLO! 1,967,338 likes · 65,887 talking about this. The official Facebook page for HELLO! magazine & http://www.hellomagazine.com/ FOLLOW US @...",https://www.facebook.com/hello
HELLO! | Facebook,"HELLO! 1,967,338 likes · 65,887 talking about this. The official Facebook page for HELLO! magazine & http://www.hellomagazine.com/ FOLLOW US @...",https://www.facebook.com/hello
Hello — Caller ID & Blocking - Android Apps on Google Play,"04-08-2015 · Make your phone smarter with Hello. Built by Messenger just for Android, Hello combines info from Facebook with the contact info on your phone so it's easy to …",https://play.google.com/store/apps/details?id=com.facebook.phone
Hello,"Sense by Hello wakes you up feeling great, improves your sleep, and helps you learn how the environment of your bedroom affects your rest.",https://hello.is/
"HELLO! Royalty - HELLO! Online: celebrity & royal news, …","Royal News: Get the latest royal family news, photos, features & live exclusives from royals, European & around the world, at HELLO! Magazine today",http://www.hellomagazine.com/royalty/
Hello (2008) - IMDb,"Directed by Atul Agnihotri. With Bharti Achrekar, Amrita Arora, Sharman Joshi, Katrina Kaif. Hello... is a tale about the events that happen one night at a call center. Told …",http://www.imdb.com/title/tt1087856/
"Adele — Hello — Listen, watch, download and discover music …","Watch the video, get the download or listen to Adele – Hello for free. Hello appears on the album 25. ""Hello"" was the first single released from Adele's long awaited third …",http://www.last.fm/music/Adele/_/Hello
Songtext von Adele - Hello Lyrics,"Hello Songtext von Adele mit Lyrics, deutscher Übersetzung, Musik-Videos und Liedtexten kostenlos auf Songtexte.com",http://www.songtexte.com/songtext/adele/hello-4379270f.html
Adele – Hello Lyrics | Genius,"Hello Lyrics [Verse 1] Hello, it's me I was wondering if after all these years You'd like to meet, to go over everything They say that time's supposed to heal ya",https://genius.com/Adele-hello-lyrics
Hello English: Learn English - Android Apps on Google Play,"07-02-2017 · Everyone know English is most important language throughout the world. So we should try for learning this language. This way is very easy, learning through …",https://play.google.com/store/apps/details?id=com.CultureAlley.japanese.english&hl=en
airtel hello tunes - search and get it online,"make your favorite song your airtel hello tunes. copy, share and even gift your friends.",https://www.airtelhellotunes.in/
Hello Kids- Home,We thank you for your efforts in putting the child to grow & improve. Good to see the child's progress in learning new things & allow to teach them good habits.,http://www.hellokids.co.in/
The Official Home of Hello Kitty & Friends | Sanrio,"The official website for all things Sanrio - the official home of Hello Kitty & Friends - games, events, characters, videos, shopping and more!",https://www.hellokitty.com/
What is Windows Hello?,"29-09-2016 · Video embedded · Learn how to set up Windows Hello to unlock your PC with your fingerprint, face, or iris without a password.",https://support.microsoft.com/en-us/help/17215/windows-10-what-is-hello
HELLO! | Facebook,"HELLO! 1,967,375 likes · 71,643 talking about this. The official Facebook page for HELLO! magazine & http://www.hellomagazine.com/ FOLLOW US @...",https://www.facebook.com/hello
Windows 10 Anniversary Update Features | See What’s New | Microsoft,"See new features in the Windows 10 Anniversary Update launched Aug 2, 2016: Sticky Notes w/Cortana, Music controls, Microsoft Edge, Windows Hello, Windows Ink & …",http://www.microsoft.com/en-US/windows/features
"HELLO! Royalty - HELLO! Online: celebrity & royal news, …","Royal News: Get the latest royal family news, photos, features & live exclusives from royals, European & around the world, at HELLO! Magazine today",http://www.hellomagazine.com/royalty/
Legally Binding Electronic Signatures | HelloSign,"HelloSign is compliant with all major eSignature laws including ESIGN, UETA, and European eIDAS. Our SSL encryption, world-class server infrastructure and audit trails …",https://www.hellosign.com/
Hello (tradução) - Adele - VAGALUME,Video embedded · Adele - Hello (tradução) (música para ouvir e letra da música com legenda em português)! Hello from the other side / I must've called a thousand times / …,https://www.vagalume.com.br/adele/hello-traducao.html
"Hello Synonyms, Hello Antonyms | Thesaurus.com","Synonyms for hello at Thesaurus.com with free online thesaurus, antonyms, and definitions. Dictionary and Word of the Day.",http://www.thesaurus.com/browse/hello
LIONEL RICHIE LYRICS - Hello - A-Z Lyrics,"Lyrics to ""Hello"" song by LIONEL RICHIE: I've been alone with you Inside my mind And in my dreams I've kissed your lips A thousand times...",http://www.azlyrics.com/lyrics/lionelrichie/hello.html
,,
