Title,Discription,Url
Computer - Wikipedia,Computers and computing devices from different eras. A computer is a device that can be instructed to carry out an arbitrary set of arithmetic or logical operations automatically.,https://en.wikipedia.org/wiki/Computer
What is a Computer? A Webopedia Definition,A computer is a programmable machine. The two principal characteristics of a computer are: It responds to a specific set of instructions in a well-defined manner and it can …,http://www.webopedia.com/TERM/C/computer.html
What is a Computer ? - Computer Hope,"Computer dictionary definition for what computer means including related links, information, and terms.",http://www.computerhope.com/jargon/c/computer.htm
Computer Basics: What is a Computer? - Full Page,"What is a computer? A computer is an electronic device that manipulates information, or data. It has the ability to store, retrieve, and process data.",http://www.gcflearnfree.org/computerbasics/what-is-a-computer/1/
What is computer? - Definition from WhatIs.com,A computer is a device that accepts information (in the form of digitalized data) and manipulates it for some result based on a program or sequence of instructions on how …,http://searchwindowsserver.techtarget.com/definition/computer
Computer | Define Computer at Dictionary.com,"Computer definition, a programmable electronic device designed to accept data, perform prescribed mathematical and logical operations at high speed, and display the results …",http://www.dictionary.com/browse/computer
Computer - definition of computer by The Free Dictionary,"com·put·er (kəm-pyo͞o′tər) n. 1. a. A device that computes, especially a programmable electronic machine that performs high-speed mathematical or logical operations or that …",http://www.thefreedictionary.com/computer
Computer | Definition of Computer by Merriam-Webster,Define computer: an electronic machine that can store and work with large amounts of information — computer in a sentence,https://www.merriam-webster.com/dictionary/computer
Computer science - Wikipedia,"Computer science is the study of the theory, experimentation, and engineering that form the basis for the design and use of computers. It is the scientific and practical …",https://en.wikipedia.org/wiki/Computer_science
Computer Basics: What is a Computer? - Full Page,"What is a computer? A computer is an electronic device that manipulates information, or data. It has the ability to store, retrieve, and process data.",http://www.gcflearnfree.org/computerbasics/what-is-a-computer/1/
IEEE Xplore: Computer,"Computer, the flagship publication of the IEEE Computer Society, publishes peer-reviewed articles written for and by computer researchers and practitioners …",http://ieeexplore.ieee.org/xpl/RecentIssue.jsp?punumber=2
What is a Computer? (with pictures),"A computer is a machine that performs computations according to instructions. Once unwieldy and slow, modern computers can even...",http://www.wisegeek.com/what-is-a-computer.htm
Computer Era,"People use a password to login to the Windows computer. Sometimes we forget the password, lost access to all the installed software and valuable data stored on the …",http://computerera.co.in/
Dell Official Site,"Dell provides technology solutions, services and support. Visit Dell.com for Laptops, Netbooks, Tablet PCs, Desktops, Monitors, Servers, Storage, Printers and Computer …",http://www.dell.com/en-us/
Computer | Definition of Computer by Merriam-Webster,Define computer: an electronic machine that can store and work with large amounts of information — computer in a sentence,https://www.merriam-webster.com/dictionary/computer
Computer File Explorer - Android Apps on Google Play,"31-01-2017 · Computer is a free, full-featured file explorer, designed to support multiple tabs and windows opened side-by-side. It provides access to pictures, music, video, …",https://play.google.com/store/apps/details?id=com.pcvirt.Computer
Computer Accessories - Amazon.in,Now buy computer accessories online at Amazon.in. Having the right computer accessories can help you work faster and perform better. Amazon.in hosts a huge …,http://www.amazon.in/Computer-Accessories/b?ie=UTF8&node=1375248031
Computer Magazine | Flagship magazine of the IEEE Computer …,"In this golden anniversary year, Computer celebrates not only its impressive past, but als... Read More... What's New. The Impossible Thing. In this inaugural column, the …",https://www.computer.org/computer-magazine/
My Computer,"Computer dictionary definition for what My Computer means including related links, examples, pictures, information, and terms.",http://www.computerhope.com/jargon/m/mycomput.htm
Computer Accessories - Amazon.in,Now buy computer accessories online at Amazon.in. Having the right computer accessories can help you work faster and perform better. Amazon.in hosts a huge …,http://www.amazon.in/Computer-Accessories/b?ie=UTF8&node=1375248031
Apple,The pefect match. Accessories made by Apple. iPad Pro. Super. Computer. Airpods. Watch the film. Apple TV. The new TV app. One place for everything you want to watch.,https://www.apple.com/
Software and expertise to fuel digital transformation - CA …,Digital transformation within the application economy—from planning to development to management to security.,https://www.ca.com/us.html
"Computer Pictures, Images & Photos | Photobucket","Browse Computer pictures, photos, images, GIFs, and videos on Photobucket",http://photobucket.com/images/computer
computer - Wiktionary,"28-01-2017 · Hyphenation: com‧put‧er; Rhymes: -uːtə(r) Noun . computer (plural computers) (now rare, chiefly historical) A person employed to perform computations; …",https://en.wiktionary.org/wiki/computer
Google Drive,Google Drive,http://drive.google.com/
Acer,"Acer’s product range includes laptop and desktop PCs, tablets, smartphones, monitors, projectors and cloud solutions for home users, business, government and education.",https://www.acer.com/ac/en/US/content/home
Computer Accessories & Peripherals | Amazon.com,Shop a wide selection of Computer Accessories & Peripherals at Amazon.com. Free shipping and free returns on eligible items.,https://www.amazon.com/Computer-Accessories-Supplies/b?ie=UTF8&node=172456
"Laptop Computers, PC's & Notebooks| HP® Official Store","Buy your next laptop computer directly from HP. Shop Laptops, notebooks & tablets for your needs. See reviews, deals and upgrade options now + Free Shipping.",http://store.hp.com/us/en/cat/Laptops
"Computer GK Questions, Quiz, Old Papers",कंप्यूटर सामान्य ज्ञान प्रश्नोत्तरी (Computer GK Quiz in Hindi) GK Sample Question Paper No. 72: Computer GK Sample Question Paper as part of …,http://www.computergk.in/
"Avast | Download Free Antivirus for PC, Mac & Android","Protect your devices with the best free antivirus on the market. Download Avast antivirus and anti-spyware protection for your PC, Mac and Android.",http://www.avast.com/
The History of Computers,"07-10-2016 · Throughout human history, the closest thing to a computer was the abacus, which is actually considered a calculator since it required a human operator.",http://inventors.about.com/od/famousinventions/fl/The-History-of-Computers.htm
"Raspberry Pi - Teach, Learn, and Make with Raspberry Pi","The Raspberry Pi is a tiny and affordable computer that you can use to learn programming through fun, practical projects. Join the global Raspberry Pi Community.",http://raspberrypi.org/
"Laptop Computers, PC's & Notebooks| HP® Official Store","Buy your next laptop computer directly from HP. Shop Laptops, notebooks & tablets for your needs. See reviews, deals and upgrade options now + Free Shipping.",http://store.hp.com/us/en/cat/Laptops
Download Google Drive - Free Cloud Storage,"Get 15GB of free cloud storage today and keep your life connected by downloading Google Drive for your smartphone, tablet, and computer.",https://www.google.com/drive/download/
Google Chromebooks,"The Chromebook is a new, faster computer. It starts in seconds, and offers thousands of apps. It has built-in virus protection, and backs up your stuff in the cloud. With …",https://www.google.com/chromebook/
My Computer - Intelligent Business Automation Solutions,"With our Intelligent Business Automation software solutions, you will spend less time managing your business and more time growing your business.",http://www.mycomputer.net.in/
Computer Fundamental Tutorial - Tutorials for,COMPUTER FUNDAMENTAL TUTORIAL Simply Easy Learning by tutorialspoint.com tutorialspoint.com . 2 ABOUT THE TUTORIAL Computer Fundamentals Tutorial …,http://www.tutorialspoint.com/computer_fundamentals/computer_fundamentals_tutorial.pdf
computer - Wiktionary,"28-01-2017 · Hyphenation: com‧put‧er; Rhymes: -uːtə(r) Noun . computer (plural computers) (now rare, chiefly historical) A person employed to perform computations; …",https://en.wiktionary.org/wiki/computer
How to Format a Computer (with Pictures) - wikiHow,"29-06-2016 · Video embedded · How to Format a Computer. Formatting a computer involves erasing all of the data on the computer's hard drive, and then reinstalling the …",http://www.wikihow.com/Format-a-Computer
,,
